{
  "schema_version": "skyrim-analyzer-rule-pack-v1",
  "pack_id": "skyrim-mod-factory-core-prevention",
  "description": "Initial cross-layer prevention rules for AI-generated Skyrim mod builds.",
  "rules": [
    {
      "schema_version": "skyrim-analyzer-rule-v1",
      "rule_id": "SKYRIM-ARMO-ARMA-SLOT-MISMATCH",
      "title": "Armor, ArmorAddon and NIF slots disagree",
      "scope": [
        "armor",
        "mesh",
        "biped"
      ],
      "severity": "ERROR",
      "detection": {
        "kind": "cross-layer",
        "algorithm": "Compare ARMO body mask, linked ARMA masks/races, and NIF skin partitions for every generated armor variant.",
        "required_data": [
          "ARMO",
          "ARMA",
          "NIF partitions",
          "race biped mapping"
        ],
        "false_positive_exclusions": [
          "explicit intentional hidden-body-slot strategy"
        ]
      },
      "fix_policy": {
        "mode": "proposal",
        "algorithm": "Reconcile the intended numeric slot mask and regenerate affected mesh outputs.",
        "postconditions": [
          "slot masks satisfy manifest",
          "NIF validator passes",
          "visual test passes"
        ]
      },
      "evidence": [
        {
          "source": "https://github.com/BadDogSkyrim/PyNifly",
          "type": "upstream-source",
          "notes": "Validated for inclusion in the core Agent OS prevention pack on 2026-09-24."
        }
      ]
    },
    {
      "schema_version": "skyrim-analyzer-rule-v1",
      "rule_id": "SKYRIM-CTDA-SEMANTIC-LOSS",
      "title": "Condition patch loses CTDA semantics",
      "scope": [
        "CTDA",
        "condition"
      ],
      "severity": "ERROR",
      "preconditions": [
        "A patcher copies/merges condition entries"
      ],
      "bad_pattern": "Function/value is forwarded without preserving comparison flags, parameter interpretation, Run On, reference, parameter 3, or ordering/OR semantics.",
      "why": "CTDA behavior depends on the entire encoded predicate, not just visible function name.",
      "detection": {
        "kind": "plugin",
        "algorithm": "Normalize and compare full CTDA tuples using xEdit schema; flag partial field copies and changed OR ordering.",
        "required_data": [
          "source CTDA",
          "output CTDA"
        ],
        "false_positive_exclusions": [
          "explicit intentional condition rewrite"
        ]
      },
      "fix_policy": {
        "mode": "proposal",
        "algorithm": "Copy/rebuild the entire intended predicate or regenerate from typed condition model.",
        "postconditions": [
          "normalized CTDA equals intended predicate"
        ]
      },
      "fixture_id": "F20",
      "evidence": [
        {
          "source": "knowledge/libraries/skyrim-modding/terminology/ctda-condition-encoding-xedit.md",
          "type": "user-validated"
        }
      ]
    },
    {
      "schema_version": "skyrim-analyzer-rule-v1",
      "rule_id": "SKYRIM-DLL-RUNTIME-MISMATCH",
      "title": "Native SKSE plugin runtime/API mismatch",
      "scope": [
        "native",
        "skse",
        "runtime"
      ],
      "severity": "BLOCKER",
      "detection": {
        "kind": "native",
        "algorithm": "Compare active executable/SKSE/Address Library against DLL metadata, dependencies and startup log.",
        "required_data": [
          "runtime",
          "SKSE",
          "Address Library",
          "DLL metadata",
          "plugin log"
        ],
        "false_positive_exclusions": [
          "optional integration disabled on this runtime"
        ]
      },
      "fix_policy": {
        "mode": "proposal",
        "algorithm": "Install/build the correct runtime binary or narrow the supported runtime matrix.",
        "postconditions": [
          "DLL loads",
          "required hooks/APIs report ready",
          "runtime smoke test passes"
        ]
      },
      "evidence": [
        {
          "source": "https://github.com/alandtse/CommonLibSSE-NG",
          "type": "upstream-source",
          "notes": "Validated for inclusion in the core Agent OS prevention pack on 2026-09-24."
        }
      ]
    },
    {
      "schema_version": "skyrim-analyzer-rule-v1",
      "rule_id": "SKYRIM-GENERATED-OUTPUT-STALE",
      "title": "Generated output is stale",
      "scope": [
        "generated-output",
        "build-graph"
      ],
      "severity": "ERROR",
      "detection": {
        "kind": "generated-output",
        "algorithm": "Compare recorded input hashes, settings and load-order epoch against current dependency graph.",
        "required_data": [
          "generator manifest",
          "input hashes",
          "load order",
          "settings"
        ],
        "false_positive_exclusions": [
          "frozen vendor artifact not generated by this project"
        ]
      },
      "fix_policy": {
        "mode": "automatic",
        "algorithm": "Remove only stale generated staging output, rerun its generator, validate, then rebuild downstream dependents.",
        "postconditions": [
          "input hashes match",
          "generator passes",
          "downstream gates pass"
        ]
      },
      "evidence": [
        {
          "source": "https://dyndolod.info/Help/Command-Line-Argument",
          "type": "upstream-doc",
          "notes": "Validated for inclusion in the core Agent OS prevention pack on 2026-09-24."
        }
      ]
    },
    {
      "schema_version": "skyrim-analyzer-rule-v1",
      "rule_id": "SKYRIM-MISSING-ASSET",
      "title": "Referenced required asset is missing",
      "scope": [
        "plugin",
        "NIF",
        "config",
        "UI",
        "voice"
      ],
      "severity": "ERROR",
      "preconditions": [
        "A required path is referenced"
      ],
      "bad_pattern": "Resolved VFS/package contains no file at the required path.",
      "why": "Missing models/textures/scripts/voice/UI files cause visible failure or runtime errors.",
      "detection": {
        "kind": "asset",
        "algorithm": "Build path-closure graph from plugin/NIF/config/UI references and resolve against actual deployed/VFS winners.",
        "required_data": [
          "referenced paths",
          "VFS file index"
        ],
        "false_positive_exclusions": [
          "engine-generated optional path",
          "conditional installer branch not selected"
        ]
      },
      "fix_policy": {
        "mode": "automatic",
        "algorithm": "If missing file is a declared generated output, regenerate it; otherwise block and identify missing source/dependency.",
        "postconditions": [
          "all required paths resolve"
        ]
      },
      "fixture_id": "F12",
      "evidence": [
        {
          "source": "knowledge/libraries/skyrim-modding/automation/validation-gates.md",
          "type": "user-validated"
        }
      ]
    },
    {
      "schema_version": "skyrim-analyzer-rule-v1",
      "rule_id": "SKYRIM-NATIVE-TARGET-MATRIX-INCOMPLETE",
      "title": "Declared native runtime target was not built and verified",
      "scope": [
        "native",
        "SKSE",
        "build"
      ],
      "severity": "BLOCKER",
      "preconditions": [
        "Project manifest declares more than one Skyrim runtime/distribution target for a native DLL"
      ],
      "bad_pattern": "Release artifact is promoted after building/testing only a subset of the declared target matrix.",
      "why": "CommonLib abstractions and one successful binary do not prove every runtime's relocations, ABI, metadata, imports and hooks are valid.",
      "detection": {
        "kind": "native",
        "algorithm": "Compare project target matrix against CMake preset/configure/build records, output DLL hashes, metadata/import scans and runtime smoke results. Every declared target must have an explicit pass, supported universal-binary proof, or removal from the support claim.",
        "required_data": [
          "project targets",
          "build reports",
          "DLL hashes",
          "runtime compatibility declarations",
          "runtime test results"
        ],
        "false_positive_exclusions": [
          "single verified universal binary whose exact declared runtime coverage is independently confirmed"
        ]
      },
      "fix_policy": {
        "mode": "proposal",
        "algorithm": "Build and validate missing target(s), narrow the published support matrix, or supply a verified universal binary with exact runtime guards.",
        "postconditions": [
          "all published targets have build evidence",
          "all release-native targets have load/init evidence"
        ]
      },
      "evidence": [
        {
          "source": "knowledge/libraries/skyrim-modding/automation/validation-gates.md",
          "type": "user-validated",
          "notes": "G09 already requires every declared target build; this rule makes incomplete matrices machine-detectable."
        },
        {
          "source": "https://github.com/alandtse/CommonLibSSE-NG",
          "type": "upstream-doc"
        }
      ]
    },
    {
      "schema_version": "skyrim-analyzer-rule-v1",
      "rule_id": "SKYRIM-NAVM-DELETED",
      "title": "Deleted navmesh detected",
      "scope": [
        "navmesh",
        "plugin",
        "world"
      ],
      "severity": "BLOCKER",
      "detection": {
        "kind": "plugin",
        "algorithm": "Scan touched NAVM records for the Deleted record flag and report cell/worldspace plus override chain.",
        "required_data": [
          "NAVM records",
          "record flags",
          "cell/worldspace"
        ],
        "false_positive_exclusions": []
      },
      "fix_policy": {
        "mode": "manual",
        "algorithm": "Repair through a navmesh-safe CK/xEdit workflow; do not apply ordinary UDR logic.",
        "postconditions": [
          "no unintended deleted NAVM",